text,label,score,all_labels,all_scores,text_short
"2023 N A C H H A LT I G K E I T S B E R I C H T Inhalt Navigationshilfe Kapitelverweise innerhalb des Nachhaltigkeitsberichts Verweise auf Websites 6 Vorwort 9 Über den Bericht 12 Nachhaltigkeit in der Unternehmens-DNA 13 Corporate Governance 17 Konzernstrategie NEW AUTO 22 ESG-Performance-Management und Wesentlichkeitsanalyse 25 Nachhaltigkeitsmanagement 27 Nachhaltigkeitswirkungen neuer Mobilitätsangebote 30 Stakeholder-Management 33 Umwelt-Compliance-Management 42 Risikomanagement 45 Corporate Citizenship Fokusthemen 1 Dekarbonisierung 48 Dekarbonisierung 69 EU-Taxonomie 2 Kreislaufwirtschaft 83 Kreislaufwirtschaft 3 Menschen in der Transformation 90 Menschen in der Transformation 4 Vielfalt 104 Vielfalt 5 Integrität und Compliance 109 Integrität und Compliance 6 Lieferkette und Menschenrechte 117 Lieferkette und Menschenrechte 131 Anhang 132 Vermerk des unabhängigen Wirtschaftsprüfers 135 Impressum 2 Nachhaltigkeits kommunikation des Volkswagen Konzerns 2023 G E S C H Ä F T S B E R I C H T 2023 N A C H H A LT I G K E I T S B E R I C H T Begleitende Informationen zur Berichterstattung ESG-Kennzahlen Indikatoren entlang unserer Fokusthemen sind in Excel übersichtlich dargestellt GRI-Index GRI-Inhaltsindex (unter Bezugnahme) SASB-Index Index Automobile Berichte zu Sonderthemen Responsible Raw Materials Report Fortschritte bei Transparenz und Risiko minderung in den Rohstofflieferketten (jährlich) Association Climate Review Report Übersicht zu klimapolitischen Positionen Green Finance Report Umsetzung nachhaltiger Finanzierungs strategien (jährlich) Weitere ESG-Themen Informationen zu weiteren Themen, die im Be reich Nachhaltigkeit und ESG von Bedeutung sind Informationen auf der Konzern-Website Policies Selbstverpflichtungen und Grundsätze, die konzernweit gelten ESG-Kontroversen Informationen zu aktuellen und laufenden Kontroversen in sachlicher Form Internationale Initiativen UN Sustainable Development Goals Aktivitäten und Projekte, die zur Erreichung der Nachhaltigkeitsziele beitragen (jährlich) UN Global Compact Umsetzung der zehn UN-Global-CompactPrinzipien (jährlich) CDP Score Report – Climate Change Bewertung der klimabezogenen Risiken, Ziele und Maßnahmen CDP Score Report – Water Security Bewertung im Bereich Wasserressourcen Nachhaltigkeit und ESG sind Teil der Konzernstrategie ESG-Performance ESG-Performance Ziel ist es, die Leistung in ESG-Ratings und -Rankings des Kapitalmarkts zu ver bessern, um die Investitionsfähigkeit zu steigern und Kapitalkosten zu optimieren.",fragwürdige Nachhaltigkeitsaussage,0.558354377746582,"['fragwürdige Nachhaltigkeitsaussage', 'vage Behauptung', 'konkrete Maßnahme']","[0.558354377746582, 0.23390288650989532, 0.20774275064468384]",2023 N A C H H A LT I G K E I T S B E R I C H T Inhalt Navigationshilfe Kapitelverweise innerhalb des Nachhaltigkeitsberichts Verweise auf Websites 6 
"Auf unserem Weg vom Automobilhersteller zum Mobilitätskonzern ordnen wir mit der Konzernstrategie NEW AUTO unsere Prioritäten neu und stellen uns zukunftsgerichtet auf. Dabei behalten wir unser Ziel, ein weltweit führender Anbieter nachhaltiger Mobilität zu sein, fest im Blick und richten den Konzern fokussierter, effizienter, innovativer, kundennäher, nachhaltiger und konsequent auf profitables Wachstum aus.",konkrete Maßnahme,0.42983943223953247,"['konkrete Maßnahme', 'vage Behauptung', 'fragwürdige Nachhaltigkeitsaussage']","[0.42983943223953247, 0.2966957986354828, 0.27346473932266235]",Auf unserem Weg vom Automobilhersteller zum Mobilitätskonzern ordnen wir mit der Konzernstrategie NEW AUTO unsere Prioritäten neu und stellen uns zuku
Die Konzernstrategie NEW AUTO definiert für den Bereich Nachhaltigkeit und ESG in der Konzerninitiative 6 die sechs oben abgebildeten wesentlichen Fokusthemen. Nach diesen ist der vorliegende Nachhaltigkeitsbericht inklusive nichtfinanzieller Bericht strukturiert.,konkrete Maßnahme,0.6058422923088074,"['konkrete Maßnahme', 'vage Behauptung', 'fragwürdige Nachhaltigkeitsaussage']","[0.6058422923088074, 0.2396409660577774, 0.15451669692993164]",Die Konzernstrategie NEW AUTO definiert für den Bereich Nachhaltigkeit und ESG in der Konzerninitiative 6 die sechs oben abgebildeten wesentlichen Fok
"Darüber hinaus erfolgt im Kapitel „Nachhaltigkeit in der Unternehmens-DNA“ eine Definition von Nachhaltigkeit für das Unternehmen und ein Einblick in Themen wie Risikomanagement, Umweltmanagement, Stakeholder-Management und Corporate Citizenship.",konkrete Maßnahme,0.6817368268966675,"['konkrete Maßnahme', 'vage Behauptung', 'fragwürdige Nachhaltigkeitsaussage']","[0.6817368268966675, 0.23363067209720612, 0.0846325233578682]",Darüber hinaus erfolgt im Kapitel „Nachhaltigkeit in der Unternehmens-DNA“ eine Definition von Nachhaltigkeit für das Unternehmen und ein Einblick in 
"Nachhaltigkeit in der Unter nehmens-DNA Dekarbonisierung Kreislauf wirtschaft Menschen in der Transformation Vielfalt Integrität und Compliance Lieferkette und Menschenrechte Progressive Core Sport Luxury Trucks Architecture Software Battery, Charging & Energy Volkswagen Group Mobility 06 | ESG, Decarbonization and Integrity Highlights 20231 Dekarbonisierung Zugang zu 600.000 Ladepunkten in Europa Bis 2030 soll der CO2-Fußabdruck des gesamten Handelsnetzes um mindestens 30 % gesenkt werden.",fragwürdige Nachhaltigkeitsaussage,0.45029303431510925,"['fragwürdige Nachhaltigkeitsaussage', 'konkrete Maßnahme', 'vage Behauptung']","[0.45029303431510925, 0.3446248769760132, 0.20508207380771637]",Nachhaltigkeit in der Unter nehmens-DNA Dekarbonisierung Kreislauf wirtschaft Menschen in der Transformation Vielfalt Integrität und Compliance Liefer
Weltweit Frauenanteile im Management und Internationalität im Top-Management gesteigert 2023 wurden mehr als 4.100 Geschäftspartner geprüft. 1.551 Anfragen hat der Infopoint Compliance bearbeitet. Lieferkette und Menschenrechte Integrität und Compliance 7.791 direkte Lieferanten wurden weltweit zu Nachhaltigkeit geschult.,vage Behauptung,0.45046794414520264,"['vage Behauptung', 'fragwürdige Nachhaltigkeitsaussage', 'konkrete Maßnahme']","[0.45046794414520264, 0.33468547463417053, 0.21484659612178802]",Weltweit Frauenanteile im Management und Internationalität im Top-Management gesteigert 2023 wurden mehr als 4.100 Geschäftspartner geprüft. 1.551 Anf
"Und mit dieser Haltung schaffen wir nachhaltig langfristigen Mehrwert. Für unsere Belegschaft, unsere Kunden, unsere Investoren – und für unsere Gesellschaft im Ganzen. Als einer der weltweit größten Industriekonzerne tragen wir eine besondere Verantwortung. Wir können einen Unterschied machen. Diese Chance wollen und werden wir nutzen. Wir denken Nachhaltigkeit ganzheitlich – im Sinne der Natur, der Menschen, der Gesellschaft und des wertschaffenden Unternehmertums.",konkrete Maßnahme,0.42321962118148804,"['konkrete Maßnahme', 'vage Behauptung', 'fragwürdige Nachhaltigkeitsaussage']","[0.42321962118148804, 0.38252994418144226, 0.1942504495382309]","Und mit dieser Haltung schaffen wir nachhaltig langfristigen Mehrwert. Für unsere Belegschaft, unsere Kunden, unsere Investoren – und für unsere Gesel"
"Nachhaltigkeit als Strategie: klare Ziele, klare Verantwortung Nachhaltigkeit gehört bei uns zu den Top-Prioritäten. Als strategisches Feld setzen wir uns in der Nachhaltigkeit klare Ziele und Pläne – verbindlich und mit eindeutigen Verantwort lichkeiten. Der Fokus liegt dabei auf dem Umsetzen unserer strategischen Maßnahmen. Und auch hier nutzen wir die Synergien im Volkswagen Konzern: Alle Ziele werden systematisch auf die Marken und Konzern gesellschaften heruntergebrochen.",konkrete Maßnahme,0.574341356754303,"['konkrete Maßnahme', 'vage Behauptung', 'fragwürdige Nachhaltigkeitsaussage']","[0.574341356754303, 0.23426763713359833, 0.19139103591442108]","Nachhaltigkeit als Strategie: klare Ziele, klare Verantwortung Nachhaltigkeit gehört bei uns zu den Top-Prioritäten. Als strategisches Feld setzen wir"
"Es ist in der persönlichen Verantwortung des Managements, diese einzuhalten. Dekarbonisierung: Herzstück unseres Antriebs Der Volkswagen Konzern bekennt sich klar zur Elektromobi lität. Begeisternde Produktneuheiten in den vergangenen Wochen und Monaten – wie der Audi Q6 etron, der VW ID.7, der Porsche Macan electric oder der ID.Buzz mit langem Radstand – zeigen: Die E-Mobilität steht für Emotion und Faszination. Auch unsere Auslieferungszahlen bestätigen diesen Trend.",vage Behauptung,0.44107478857040405,"['vage Behauptung', 'fragwürdige Nachhaltigkeitsaussage', 'konkrete Maßnahme']","[0.44107478857040405, 0.43239495158195496, 0.12653031945228577]","Es ist in der persönlichen Verantwortung des Managements, diese einzuhalten. Dekarbonisierung: Herzstück unseres Antriebs Der Volkswagen Konzern beken"
"Oliver Blume, Vorstandsvorsitzender der Volkswagen AG Daniela Cavallo, Vorsitzende des Gesamt- und Konzernbetriebsrats der Volkswagen AG Inhalt Unternehmens-DNA | Dekarbonisierung | Kreislaufwirtschaft | Menschen in der Transformation | Vielfalt | Integrität und Compliance | Lieferkette und Menschenrechte Vorwort 7 Ein zentraler Hebel zur Reduktion von Emissionen ist die Produktion: Unser Ziel ist es, die produktionsbedingten CO2-Emissionen von Pkw und leichten Nutzfahrzeugen bis 2030 um 50,4 Prozent im Vergleich zum Basisjahr 2018 zu reduzieren.",konkrete Maßnahme,0.449057012796402,"['konkrete Maßnahme', 'fragwürdige Nachhaltigkeitsaussage', 'vage Behauptung']","[0.449057012796402, 0.3506947457790375, 0.20024821162223816]","Oliver Blume, Vorstandsvorsitzender der Volkswagen AG Daniela Cavallo, Vorsitzende des Gesamt- und Konzernbetriebsrats der Volkswagen AG Inhalt Untern"
"Die renommierte Science Based Targets Initiative (SBTi) hat bestätigt, dass unser Unternehmen mit dieser Zielsetzung für die Produktionsphase (Scope 1 und 2) die Voraussetzungen erfüllt, mit dazu beizutragen, die Erderwärmung auf 1,5 Grad Celsius zu begrenzen. Das Ziel, die CO2-Emissionen in der Nutzungsphase (Scope 3) um 30 Prozent zu reduzieren, ist durch SBTi als konform mit der Begrenzung der Erderwärmung auf 2 Grad bestätigt worden. Dieses Zeugnis ist ein Ansporn.",vage Behauptung,0.6143588423728943,"['vage Behauptung', 'konkrete Maßnahme', 'fragwürdige Nachhaltigkeitsaussage']","[0.6143588423728943, 0.2403576821088791, 0.14528343081474304]","Die renommierte Science Based Targets Initiative (SBTi) hat bestätigt, dass unser Unternehmen mit dieser Zielsetzung für die Produktionsphase (Scope 1"
"Dies zielt durchaus auch auf den unternehme rischen Erfolg ab. Denn Arbeitgeberattraktivität ist längst keine reine Frage des Gehalts mehr. Talente bewerten bei potenziellen Arbeitgebern genauso Faktoren wie Flexibilität, Vereinbarkeit von Privatleben und Beruf, Diversität sowie soziale Leistungen und Eigenverantwortung. Was bedeuten diese Veränderungen für den Volkswagen Konzern?",fragwürdige Nachhaltigkeitsaussage,0.5228215456008911,"['fragwürdige Nachhaltigkeitsaussage', 'vage Behauptung', 'konkrete Maßnahme']","[0.5228215456008911, 0.3761274814605713, 0.10105099529027939]",Dies zielt durchaus auch auf den unternehme rischen Erfolg ab. Denn Arbeitgeberattraktivität ist längst keine reine Frage des Gehalts mehr. Talente be
"Die Verantwortung für „Menschen in der Transforma tion“ steht im Zentrum aktueller und zukünftiger Aktivitäten im Personalbereich. Eine Schlüsselrolle spielt die 2021 vom Konzernvorstand verabschiedete Group People Strategy „Transform to Tech“. Im Bereich Weiterbildung liegt das Augenmerk des Volkswagen Konzerns darauf, die Kolleginnen und Kollegen in Zukunfts technologien zu schulen. Dazu gehört eine enge Begleitung im Transformationsprozess.",vage Behauptung,0.741597592830658,"['vage Behauptung', 'fragwürdige Nachhaltigkeitsaussage', 'konkrete Maßnahme']","[0.741597592830658, 0.13783447444438934, 0.1205679178237915]",Die Verantwortung für „Menschen in der Transforma tion“ steht im Zentrum aktueller und zukünftiger Aktivitäten im Personalbereich. Eine Schlüsselrolle
Sie sollen den Menschen eine Perspektive geben und in der Transformation eine klare Richtung für den Veränderungsprozess vorgeben. Die Beschäftigungssicherung bis 2029 in der Volkswagen AG gibt den Beschäftigten dabei den notwendigen Rückhalt. Verantwortung gesamtheitlich: die Lieferkette im Blick Neben der Verantwortung für die eigenen Beschäftigten trägt der Volkswagen Konzern auch eine globale Verantwortung.,konkrete Maßnahme,0.7169702649116516,"['konkrete Maßnahme', 'fragwürdige Nachhaltigkeitsaussage', 'vage Behauptung']","[0.7169702649116516, 0.19954006373882294, 0.08348968625068665]",Sie sollen den Menschen eine Perspektive geben und in der Transformation eine klare Richtung für den Veränderungsprozess vorgeben. Die Beschäftigungss
"Das Lieferkettensorgfaltspflichtengesetz, seit einem guten Jahr in Deutschland in Kraft, hat hier eine besondere Rolle. Schwerpunkte sind der Schutz der Menschenrechte und die Minimierung umweltbezogener Risiken – beides Themen, mit denen sich der Volkswagen Konzern durch und durch identi fiziert. Eine Komponente bei der Steuerung der Nachhaltigkeit in unseren Lieferketten spielt der Austausch zwischen unseren Marken und Regionen durch das Beschaffungsnetzwerk Nach haltigkeit.",konkrete Maßnahme,0.4078418016433716,"['konkrete Maßnahme', 'fragwürdige Nachhaltigkeitsaussage', 'vage Behauptung']","[0.4078418016433716, 0.33069461584091187, 0.26146361231803894]","Das Lieferkettensorgfaltspflichtengesetz, seit einem guten Jahr in Deutschland in Kraft, hat hier eine besondere Rolle. Schwerpunkte sind der Schutz d"
Inhalt Unternehmens-DNA | Dekarbonisierung | Kreislaufwirtschaft | Menschen in der Transformation | Vielfalt | Integrität und Compliance | Lieferkette und Menschenrechte GRI 2-22 8 Technologie: der wahre Schlüssel zur Nachhaltigkeit Der Volkswagen Konzern ist seit vielen Jahrzehnten ein Tech nologieunternehmen. Diese Kompetenz werden wir auch in der Nachhaltigkeit nutzen. Denn wir sind überzeugt: Techno logie ist der Schlüssel zu Fortschritten in der Nachhaltigkeits strategie.,vage Behauptung,0.49494972825050354,"['vage Behauptung', 'konkrete Maßnahme', 'fragwürdige Nachhaltigkeitsaussage']","[0.49494972825050354, 0.42139145731925964, 0.08365887403488159]",Inhalt Unternehmens-DNA | Dekarbonisierung | Kreislaufwirtschaft | Menschen in der Transformation | Vielfalt | Integrität und Compliance | Lieferkette
"Sehr geehrte Damen und Herren, liebe Kolleginnen und Kollegen, der Volkswagen Konzern steht für Tradition und für starke Marken. Dafür, Entwicklungen voranzutreiben und Herausforderungen zu meistern. Heute befinden wir uns in der größten Transformation der Automobilgeschichte: Wir wollen nachhaltige Mobilität für Generationen ermöglichen. Nachhaltigkeit ist tief im Selbstverständnis des Volkswagen Konzerns verwurzelt. Sie ist fester Bestandteil unserer Konzern strategie.",vage Behauptung,0.589847207069397,"['vage Behauptung', 'fragwürdige Nachhaltigkeitsaussage', 'konkrete Maßnahme']","[0.589847207069397, 0.2100931853055954, 0.20005960762500763]","Sehr geehrte Damen und Herren, liebe Kolleginnen und Kollegen, der Volkswagen Konzern steht für Tradition und für starke Marken. Dafür, Entwicklungen "
"Für 2024 setzen wir hier wichtige und zielführende neue Impulse. Der Volkswagen Konzern ist sich seiner Rolle, Bedeutung und Verantwortung bewusst. Gemeinsam werden wir alles dafür tun, unseren wichtigen Beitrag zu leisten – mit Teamgeist, Fairness und Leidenschaft.",vage Behauptung,0.3749866485595703,"['vage Behauptung', 'konkrete Maßnahme', 'fragwürdige Nachhaltigkeitsaussage']","[0.3749866485595703, 0.37307408452033997, 0.2519392967224121]","Für 2024 setzen wir hier wichtige und zielführende neue Impulse. Der Volkswagen Konzern ist sich seiner Rolle, Bedeutung und Verantwortung bewusst. Ge"
"Daniela Cavallo und Oliver Blume Inhalt Unternehmens-DNA | Dekarbonisierung | Kreislaufwirtschaft | Menschen in der Transformation | Vielfalt | Integrität und Compliance | Lieferkette und Menschenrechte GRI 2-22 9 Struktur der Berichterstattung Der vorliegende Konzern-Nachhaltigkeitsbericht 2023 ori entiert sich an international etablierten Rahmenwerken und Anforderungen wie zum Beispiel den Standards der Global Reporting Initiative (GRI, siehe auch folgender Abschnitt), dem CSR-Richtlinie-Umsetzungsgesetz (CSR-RUG), ESGNachhaltigkeitsratings (Environmental, Social, Governance) und Erwartungen von Stakeholdern.",fragwürdige Nachhaltigkeitsaussage,0.470941960811615,"['fragwürdige Nachhaltigkeitsaussage', 'vage Behauptung', 'konkrete Maßnahme']","[0.470941960811615, 0.3020085394382477, 0.22704945504665375]",Daniela Cavallo und Oliver Blume Inhalt Unternehmens-DNA | Dekarbonisierung | Kreislaufwirtschaft | Menschen in der Transformation | Vielfalt | Integr
Der Bericht wird durch eine ausführliche Darstellung der Nachhaltigkeitsaktivitäten der Marken und Regionen sowie der Corporate-CitizenshipProjekte des Volkswagen Konzerns ergänzt.,konkrete Maßnahme,0.4520745873451233,"['konkrete Maßnahme', 'vage Behauptung', 'fragwürdige Nachhaltigkeitsaussage']","[0.4520745873451233, 0.28117918968200684, 0.2667462229728699]",Der Bericht wird durch eine ausführliche Darstellung der Nachhaltigkeitsaktivitäten der Marken und Regionen sowie der Corporate-CitizenshipProjekte de
Unsere Aktivitäten zum Klimaschutz berichten wir er neut entlang der Vorgaben der Task Force on Climate-related Financial Disclosures (TCFD). Darüber hinaus werden die GRI-Standards als Rahmenwerk für die Erstellung des nichtfinanziellen Berichts genutzt. Innerhalb dieses Nachhaltigkeitsberichts legt Volkswagen grundsätzlich die GRI-Standards (unter Bezugnahme) als Rahmenwerk für die Berichterstattung der Managementansätze und der spe zifischen Standardangaben zugrunde.,fragwürdige Nachhaltigkeitsaussage,0.4790402352809906,"['fragwürdige Nachhaltigkeitsaussage', 'konkrete Maßnahme', 'vage Behauptung']","[0.4790402352809906, 0.3257799446582794, 0.1951797753572464]",Unsere Aktivitäten zum Klimaschutz berichten wir er neut entlang der Vorgaben der Task Force on Climate-related Financial Disclosures (TCFD). Darüber 
"Der GRI-Inhaltsindex wird aus dem Nachhaltigkeitsbericht 2023 ausgegliedert und als eigenständiges Dokument im Konzernportal veröffentlicht: www.volkswagen-group.com > Berichte Nachhaltigkeitskommunikation des Volkswagen Konzerns www.volkswagen-group.com > Pressemitteilungen www.volkswagen-group.com > Nachhaltigkeit WEITERE KOMMUNIKATION www.volkswagen-group.com > ESG-Performance & Reporting WEBSITE NACHHALTIGKEITSBERICHT 2023 nichtfinanzieller Bericht 2023 inklusive Inhalt Unternehmens-DNA | Dekarbonisierung | Kreislaufwirtschaft | Menschen in der Transformation | Vielfalt | Integrität und Compliance | Lieferkette und Menschenrechte Über den Bericht 10 Qualifizierungsstunden pro Mitarbeiter, Unfallindizes und Unfallkennzahlen sind in den Angaben zum Volkswagen Konzern die chinesischen Joint Ventures enthalten.",fragwürdige Nachhaltigkeitsaussage,0.3551180064678192,"['fragwürdige Nachhaltigkeitsaussage', 'konkrete Maßnahme', 'vage Behauptung']","[0.3551180064678192, 0.3517961800098419, 0.2930857539176941]",Der GRI-Inhaltsindex wird aus dem Nachhaltigkeitsbericht 2023 ausgegliedert und als eigenständiges Dokument im Konzernportal veröffentlicht: www.volks
Risiken des chinesischen Markts werden über die Volkswagen (China) Investment Company Ltd. erfasst. Die dargestellten Kennzahlen führen jene der Vorjahre fort. Wesentliche Änderungen in der Datenerhebung und in den Messverfahren für unsere Nachhaltigkeitsleistungen werden an den jeweiligen Kennzahlen explizit ausgewiesen. Alle Zahlen im Bericht sind jeweils für sich gerundet; dies kann bei der Addition zu geringfügigen Abweichungen führen.,fragwürdige Nachhaltigkeitsaussage,0.4651122987270355,"['fragwürdige Nachhaltigkeitsaussage', 'konkrete Maßnahme', 'vage Behauptung']","[0.4651122987270355, 0.26959601044654846, 0.26529163122177124]",Risiken des chinesischen Markts werden über die Volkswagen (China) Investment Company Ltd. erfasst. Die dargestellten Kennzahlen führen jene der Vorja
"Unser aktueller Fortschrittsbericht ist auf der Website des UN Global Compact einsehbar: United Nations Global Compact Das Strategiekapitel und die sechs folgenden Fokuskapitel des Berichts bestehen je aus einem Textteil sowie einer konsoli dierten Kennzahlentabelle, die am Ende jedes Kapitels steht. Verweise auf Angaben außerhalb des nichtfinanziellen Be richts sind weiterführende Informationen und nicht Bestand teil dieses Berichts.",fragwürdige Nachhaltigkeitsaussage,0.5441874265670776,"['fragwürdige Nachhaltigkeitsaussage', 'vage Behauptung', 'konkrete Maßnahme']","[0.5441874265670776, 0.2281586080789566, 0.22765395045280457]",Unser aktueller Fortschrittsbericht ist auf der Website des UN Global Compact einsehbar: United Nations Global Compact Das Strategiekapitel und die se
Ebenso sind folgende Passagen nicht Bestandteil des nichtfinanziellen Berichts: • Nachhaltigkeitskommunikation des Volkswagen Konzerns (S. 3–4) • Vorwort (S. 6–8) • Der Deutsche Corporate Governance Kodex – Leitlinie für erfolgreiche Unternehmensführung (S. 15) • Weiterführende Informationen und Wertschöpfungskette (S. 16) • Soziale und ökologische Auswirkungen unseres Handelns messbar machen (S. 24) Die Angaben in diesem Bericht beziehen sich auf den ge samten Volkswagen Konzern.,fragwürdige Nachhaltigkeitsaussage,0.6317148208618164,"['fragwürdige Nachhaltigkeitsaussage', 'vage Behauptung', 'konkrete Maßnahme']","[0.6317148208618164, 0.2159915566444397, 0.15229366719722748]",Ebenso sind folgende Passagen nicht Bestandteil des nichtfinanziellen Berichts: • Nachhaltigkeitskommunikation des Volkswagen Konzerns (S. 3–4) • Vorw
"In den Kennzahlen und in den dazugehörigen Zielen bei den Themen Umweltentlastung Produktion (UEP), Dekarbo nisierungsindex (DKI), Stimmungsbarometer, Diversity-Index, GRI 2-2, 2-4, 2-5 Inhalt Unternehmens-DNA | Dekarbonisierung | Kreislaufwirtschaft | Menschen in der Transformation | Vielfalt | Integrität und Compliance | Lieferkette und Menschenrechte 11 lässt sich nicht ausschließen, dass aufgrund von zukünftigen Erkenntnissen oder Ereignissen die gebildeten Rückstellungen möglicherweise angepasst werden müssen.",fragwürdige Nachhaltigkeitsaussage,0.7532346844673157,"['fragwürdige Nachhaltigkeitsaussage', 'vage Behauptung', 'konkrete Maßnahme']","[0.7532346844673157, 0.1924491822719574, 0.054316144436597824]","In den Kennzahlen und in den dazugehörigen Zielen bei den Themen Umweltentlastung Produktion (UEP), Dekarbo nisierungsindex (DKI), Stimmungsbarometer,"
"Die übrigen Rückstellungen betreffen eine Vielzahl erkenn barer Einzelrisiken, Preisrisiken und ungewisser Verpflich tungen, die in Höhe ihres wahrscheinlichen Eintritts berück sichtigt werden. Abhängig von der jeweiligen Jurisdiktion sind darin auch Risikovorsorgen für die etwaige Nichteinhaltung von gesetzlichen Emissionsobergrenzen enthalten.",fragwürdige Nachhaltigkeitsaussage,0.44627416133880615,"['fragwürdige Nachhaltigkeitsaussage', 'vage Behauptung', 'konkrete Maßnahme']","[0.44627416133880615, 0.40609124302864075, 0.1476345658302307]","Die übrigen Rückstellungen betreffen eine Vielzahl erkenn barer Einzelrisiken, Preisrisiken und ungewisser Verpflich tungen, die in Höhe ihres wahrsch"
Deren Bewertung erfolgte unter anderem unter Berücksichtigung des jeweiligen Absatzvolumens und der gesetzlich definierten Abgabe beziehungsweise der Kosten für den Erwerb von Emissionsrechten anderer Hersteller. Die Synergien der ein zelnen Marken des Volkswagen Konzerns wurden dabei nach Möglichkeit in Form von Emissionsgemeinschaften genutzt.,fragwürdige Nachhaltigkeitsaussage,0.39414286613464355,"['fragwürdige Nachhaltigkeitsaussage', 'konkrete Maßnahme', 'vage Behauptung']","[0.39414286613464355, 0.3059571087360382, 0.2999000549316406]",Deren Bewertung erfolgte unter anderem unter Berücksichtigung des jeweiligen Absatzvolumens und der gesetzlich definierten Abgabe beziehungsweise der 
Klimaschutzbezogene Begrifflichkeiten Die Verwendung des Begriffs CO2-Emissionen in diesem Be richt schließt die Betrachtung und Ermittlung weiterer klima schädlicher Treibhausgase wie zum Beispiel Methan (CH4) und Lachgas (N2O) mit ein (CO2-Äquivalente). Alle Angaben in diesem Bericht zu CO2-Emissionen entsprechen CO2-Äqui valenten. Dies gilt nicht für die Werte der Flottenemissionen.,konkrete Maßnahme,0.5230391621589661,"['konkrete Maßnahme', 'fragwürdige Nachhaltigkeitsaussage', 'vage Behauptung']","[0.5230391621589661, 0.32332926988601685, 0.1536315679550171]",Klimaschutzbezogene Begrifflichkeiten Die Verwendung des Begriffs CO2-Emissionen in diesem Be richt schließt die Betrachtung und Ermittlung weiterer k
"Bilanzielle CO2-Neutralität wird erreicht, wenn anthropogene CO2-Emissionen weltweit durch die Vermeidung, Reduktion und Kompensation über einen spezifischen Zeitraum ausge glichen werden. Beim Klimaschutz achtet Volkswagen neben CO2-Emissionen auch auf alle anderen relevanten Treibhaus gase. Für den Volkswagen Konzern haben Vermeidung und Reduktion Priorität gegenüber Kompensation. Für Maßnahmen der Kompensation folgt das Unternehmen international etablierten Standards.",konkrete Maßnahme,0.40040323138237,"['konkrete Maßnahme', 'fragwürdige Nachhaltigkeitsaussage', 'vage Behauptung']","[0.40040323138237, 0.3406541347503662, 0.2589426040649414]","Bilanzielle CO2-Neutralität wird erreicht, wenn anthropogene CO2-Emissionen weltweit durch die Vermeidung, Reduktion und Kompensation über einen spezi"
