text,label,score,all_labels,all_scores,text_short
"Beispiele für von uns unterstützte Naturschutzprojekte weltweit finden sich auf unserer Internetseite. www.volkswagen-group.com > Engagement Inhalt Unternehmens-DNA | Dekarbonisierung | Kreislaufwirtschaft | Menschen in der Transformation | Vielfalt | Integrität und Compliance | Lieferkette und Menschenrechte 39 Kennzahlen Umwelt-Compliance-Management1 Einheit 2023 2022 Hinweise und Kommentare Umgesetzte Maßnahmen „Maßnahmen@Web“ Volkswagen Konzern Anzahl 1.540 1.431 davon Volkswagen AG Anzahl 567 466 Standorte mit ISO-14001-Zertifizierung oder EMAS-Validierung Volkswagen Konzern Anzahl 106 105 bezogen auf Mitarbeiterzahl in % 99,9 98,3 Mitarbeiterzahl an allen Produktions standorten konzernweit Volkswagen AG Anzahl 6 6 bezogen auf Mitarbeiterzahl in % 100 100 Mitarbeiterzahl an allen Produktions standorten der Volkswagen AG Standorte mit ISO-50001-Zertifizierung Volkswagen Konzern Anzahl 64 61 bezogen auf Endenergieverbrauch der Produktionsstandorte in % 88,5 80,0 Volkswagen AG Anzahl 6 6 bezogen auf Endenergieverbrauch der Produktionsstandorte in % 100 100 Umweltentlastung Produktion (UEP) | GRI 302-5 Volkswagen Konzern Pkw & leichte Nfz Veränderung UEP, gesamt in % –44,2 –37,4 Veränderung spezifischer Energiebedarf in % –21,0 –14,2 Veränderung spezifische CO2-Emissionen in % –51,0 –43,0 Veränderung spezifische VOC-Emissionen in % –68,7 –66,0 Veränderung spezifischer Wasserverbrauch in % –24,7 –17,3 Veränderung spezifischer Abfall zur Beseitigung in % –75,9 –68,5 nur produktionsspezifische Mengen Volkswagen AG Veränderung UEP, gesamt in % –21,1 –2,0 Veränderung spezifischer Energiebedarf in % –11,5 6,7 Veränderung spezifische CO2-Emissionen in % –23,7 3,8 Veränderung spezifische VOC-Emissionen in % –18,8 –15,2 Veränderung spezifischer Wasserverbrauch in % –10,2 13,1 Veränderung spezifischer Abfall zur Beseitigung in % –49,7 –37,0 nur produktionsspezifische Mengen 1 Scope: In der Konzernbetrachtung sind im Berichtsjahr folgende Standorte nicht enthalten: vier Service-Center von Scania (Johannesburg, Narasapura, Kuala Lumpur, Taoyuan City), ein Standort von MAN Truck & Bus SE (Serendah), ein Standort in China (Suzhou) sowie ein aktuell noch im Bau befindlicher Standort in China (Changchun) mit geplantem Produktionsstart zu Ende 2024.",vage Behauptung,0.34280630946159363,"['vage Behauptung', 'konkrete Maßnahme', 'fragwürdige Nachhaltigkeitsaussage']","[0.34280630946159363, 0.33657029271125793, 0.32062336802482605]",Beispiele für von uns unterstützte Naturschutzprojekte weltweit finden sich auf unserer Internetseite. www.volkswagen-group.com > Engagement Inhalt Un
"Daten für den Dezember des Berichtsjahres beruhen ggf. auf Schätzungen. Etwaige Schätzwerte des Vorjahres wurden bei der aktuellen Datenerhebung ersetzt. Inhalt Unternehmens-DNA | Dekarbonisierung | Kreislaufwirtschaft | Menschen in der Transformation | Vielfalt | Integrität und Compliance | Lieferkette und Menschenrechte 40 Kennzahlen Umwelt-Compliance-Management1 Einheit 2023 2022 Hinweise und Kommentare Endenergieverbrauch gesamt2 | GRI 302-1, 302-3 Volkswagen Konzern in Mio.",fragwürdige Nachhaltigkeitsaussage,0.39152342081069946,"['fragwürdige Nachhaltigkeitsaussage', 'vage Behauptung', 'konkrete Maßnahme']","[0.39152342081069946, 0.3435197174549103, 0.26495689153671265]",Daten für den Dezember des Berichtsjahres beruhen ggf. auf Schätzungen. Etwaige Schätzwerte des Vorjahres wurden bei der aktuellen Datenerhebung erset
"MWh/a 0,67 0,75 VOC-Emissionen | GRI 305-7 Volkswagen Konzern in t/a 13.149 13.272 davon Pkw & leichte Nfz in t/a 11.636 11.808 davon Volkswagen AG in t/a 1.381 1.179 davon weitere Konzernbereiche in t/a 1.513 1.464 Volkswagen Konzern (spezifisch) in kg/Fzg 1,29 1,40 Pkw & leichte Nfz Volkswagen AG (spezifisch) in kg/Fzg 1,69 1,77 2 Die Kennzahlen enthalten unvollständige Daten der Standorte von MAN Truck & Bus SE.",fragwürdige Nachhaltigkeitsaussage,0.43110567331314087,"['fragwürdige Nachhaltigkeitsaussage', 'vage Behauptung', 'konkrete Maßnahme']","[0.43110567331314087, 0.3242546319961548, 0.24463973939418793]","MWh/a 0,67 0,75 VOC-Emissionen | GRI 305-7 Volkswagen Konzern in t/a 13.149 13.272 davon Pkw & leichte Nfz in t/a 11.636 11.808 davon Volkswagen AG in"
"Inhalt Unternehmens-DNA | Dekarbonisierung | Kreislaufwirtschaft | Menschen in der Transformation | Vielfalt | Integrität und Compliance | Lieferkette und Menschenrechte 41 Kennzahlen Umwelt-Compliance-Management1 Einheit 2023 2022 Hinweise und Kommentare Wasserentnahme | GRI 303-3 Volkswagen Konzern in Mio. m3/a 37,41 39,18 davon Pkw & leichte Nfz in Mio. m3/a 30,84 31,63 davon Volkswagen AG in Mio. m3/a 3,51 3,62 davon weitere Konzernbereiche in Mio. m3/a 6,57 7,55 Volkswagen Konzern (spezifisch) in m3/Fzg 3,42 3,76 Pkw & leichte Nfz Volkswagen AG (spezifisch) in m3/Fzg 4,30 5,42 Wasserentnahme in Gebieten mit Wasserstress | GRI 303-3 Volkswagen Konzern in Mio. m3/a 16,36 – erstmalige Aufnahme in den Nachhal tigkeitsbericht im Berichtsjahr 2023 davon Pkw & leichte Nfz in Mio. m3/a 15,61 16,06 davon Volkswagen AG in Mio. m3/a 0,00 – erstmalige Aufnahme in den Nachhal tigkeitsbericht im Berichtsjahr 2023 davon weitere Konzernbereiche in Mio. m3/a 0,74 – erstmalige Aufnahme in den Nachhal tigkeitsbericht im Berichtsjahr 2023 Wiederverwendetes Wasser3 Volkswagen Konzern in Mio. m3/a 3,88 – erstmalige Aufnahme in den Nachhal tigkeitsbericht im Berichtsjahr 2023 davon Pkw & leichte Nfz in Mio. m3/a 3,82 – erstmalige Aufnahme in den Nachhal tigkeitsbericht im Berichtsjahr 2023 davon Volkswagen AG in Mio. m3/a 0,37 – erstmalige Aufnahme in den Nachhal tigkeitsbericht im Berichtsjahr 2023 davon weitere Konzernbereiche in Mio. m3/a 0,06 – erstmalige Aufnahme in den Nachhal tigkeitsbericht im Berichtsjahr 2023 Abfall zur Beseitigung (produktionsspezifisch) | GRI 306-5 Nicht gefährlicher Abfall Volkswagen Konzern in t/a 48.841 32.352 davon Pkw & leichte Nfz in t/a 15.123 17.680 davon Volkswagen AG in t/a 1.560 1.373 davon weitere Konzernbereiche in t/a 33.718 14.672 Volkswagen Konzern (spezifisch) in kg/Fzg 1,68 2,10 Pkw & leichte Nfz Volkswagen AG (spezifisch) in kg/Fzg 1,91 2,06 Gefährlicher Abfall Volkswagen Konzern in t/a 57.756 57.212 davon Pkw & leichte Nfz in t/a 35.546 44.095 davon Volkswagen AG in t/a 7.326 7.723 davon weitere Konzernbereiche in t/a 22.209 13.117 Volkswagen Konzern (spezifisch) in kg/Fzg 3,94 5,24 Pkw & leichte Nfz Volkswagen AG (spezifisch) in kg/Fzg 8,98 11,58 3 Die Kennzahlen enthalten keine Daten der Standorte von MAN Truck & Bus SE.",fragwürdige Nachhaltigkeitsaussage,0.38444945216178894,"['fragwürdige Nachhaltigkeitsaussage', 'vage Behauptung', 'konkrete Maßnahme']","[0.38444945216178894, 0.3390481173992157, 0.27650246024131775]",Inhalt Unternehmens-DNA | Dekarbonisierung | Kreislaufwirtschaft | Menschen in der Transformation | Vielfalt | Integrität und Compliance | Lieferkette
"Inhalt Unternehmens-DNA | Dekarbonisierung | Kreislaufwirtschaft | Menschen in der Transformation | Vielfalt | Integrität und Compliance | Lieferkette und Menschenrechte 42 Risikomanagement Risikomanagement als Frühwarnsystem Für den nachhaltigen Erfolg unseres Unternehmens ist es entscheidend, dass wir die Risiken und Chancen, die sich aus unserer Geschäftstätigkeit ergeben, frühzeitig erkennen und vorausschauend steuern.",konkrete Maßnahme,0.6060020923614502,"['konkrete Maßnahme', 'vage Behauptung', 'fragwürdige Nachhaltigkeitsaussage']","[0.6060020923614502, 0.2808856666088104, 0.11311228573322296]",Inhalt Unternehmens-DNA | Dekarbonisierung | Kreislaufwirtschaft | Menschen in der Transformation | Vielfalt | Integrität und Compliance | Lieferkette
Angemessene und wirksame Risikomanagement- und Interne Kontrollsysteme sind für uns deshalb von signifikanter Bedeutung. Risikomanagement- und Internes Kontrollsystem Der verantwortungsvolle Umgang mit Risiken wird bei uns durch ein umfassendes Risikomanagement- und Internes Kontrollsystem (RMS und IKS) unterstützt. Es definiert die wesentlichen Grundsätze und Elemente für unseren Konzern als Grundlage einer angemessenen und wirksamen Steuerung sowie Kontrolle wesentlicher Risiken.,vage Behauptung,0.49440455436706543,"['vage Behauptung', 'konkrete Maßnahme', 'fragwürdige Nachhaltigkeitsaussage']","[0.49440455436706543, 0.40768706798553467, 0.09790835529565811]",Angemessene und wirksame Risikomanagement- und Interne Kontrollsysteme sind für uns deshalb von signifikanter Bedeutung. Risikomanagement- und Interne
Dies umfasst Risiken mit Auswirkungen sowohl auf den Volkswagen Konzern als auch auf Umwelt und Gesellschaft. Damit ist es auch unmit telbar für die Bewertung von nichtfinanziellen Risiken anwend bar. Diese könnten bei der Verfolgung von Zielen und der Umsetzung von Maßnahmen in den Fokusbereichen unserer Konzernstrategie auftreten.,fragwürdige Nachhaltigkeitsaussage,0.6794437170028687,"['fragwürdige Nachhaltigkeitsaussage', 'vage Behauptung', 'konkrete Maßnahme']","[0.6794437170028687, 0.27279597520828247, 0.04776027798652649]",Dies umfasst Risiken mit Auswirkungen sowohl auf den Volkswagen Konzern als auch auf Umwelt und Gesellschaft. Damit ist es auch unmit telbar für die B
"Das Volkswagen Drei-Linien-Modell Aufsichtsrat/Vorstand Management Interne Revision Verantwortung, Berichterstattung Ausrichtung, Kommunikation, Koordination, Zusammenarbeit Delegation, Leitung, Ressourcen, Beaufsichtigung LINIE Gesellschaften und Bereiche LINIE Risikomanagement Compliance-Funktionen etc.",konkrete Maßnahme,0.4136064946651459,"['konkrete Maßnahme', 'vage Behauptung', 'fragwürdige Nachhaltigkeitsaussage']","[0.4136064946651459, 0.31380462646484375, 0.272588849067688]","Das Volkswagen Drei-Linien-Modell Aufsichtsrat/Vorstand Management Interne Revision Verantwortung, Berichterstattung Ausrichtung, Kommunikation, Koord"
LINIE Konzern-Revision Inhalt Unternehmens-DNA | Dekarbonisierung | Kreislaufwirtschaft | Menschen in der Transformation | Vielfalt | Integrität und Compliance | Lieferkette und Menschenrechte 43 Die operativen Risikomanagement- und Internen Kontroll systeme der Konzerngesellschaften und -bereiche bilden die vorderste Linie. Das RMS und IKS ist integraler Bestandteil der Aufbau- und Ablauforganisation des Volkswagen Konzerns.,konkrete Maßnahme,0.5339223146438599,"['konkrete Maßnahme', 'vage Behauptung', 'fragwürdige Nachhaltigkeitsaussage']","[0.5339223146438599, 0.32033443450927734, 0.1457432359457016]",LINIE Konzern-Revision Inhalt Unternehmens-DNA | Dekarbonisierung | Kreislaufwirtschaft | Menschen in der Transformation | Vielfalt | Integrität und C
"Das Risikomanagement des Volkswagen Konzerns wird kon tinuierlich weiterentwickelt, um den stetig steigenden inter nen und externen Anforderungen im Bereich Unternehmens verantwortung Rechnung zu tragen. Risiken mit Bezug zu den Fokusthemen Risiken, die sich auf unsere Fokusbereiche beziehen, finden sowohl in der Methodik als auch in den Inhalten unseres RMS und IKS Berücksichtigung. Im standardisierten IKS werden sogenannte Master-Kontrollkataloge eingesetzt.",fragwürdige Nachhaltigkeitsaussage,0.38893675804138184,"['fragwürdige Nachhaltigkeitsaussage', 'konkrete Maßnahme', 'vage Behauptung']","[0.38893675804138184, 0.36683711409568787, 0.2442261427640915]","Das Risikomanagement des Volkswagen Konzerns wird kon tinuierlich weiterentwickelt, um den stetig steigenden inter nen und externen Anforderungen im B"
"Darüber hinaus werden Inhalte zum Fokusthema „Dekarbo nisierung“ beispielsweise im Master-Kontrollkatalog „Umwelt und Nachhaltigkeit“ über das Risiko „Die wesentlichen Um welt- und Nachhaltigkeitsrisiken unserer Produkte, Produktion und Dienstleistungen entlang des gesamten Lebenszyklus sind nicht/unzureichend identifiziert“ berücksichtigt.",fragwürdige Nachhaltigkeitsaussage,0.6832813024520874,"['fragwürdige Nachhaltigkeitsaussage', 'konkrete Maßnahme', 'vage Behauptung']","[0.6832813024520874, 0.18555974960327148, 0.1311589926481247]",Darüber hinaus werden Inhalte zum Fokusthema „Dekarbo nisierung“ beispielsweise im Master-Kontrollkatalog „Umwelt und Nachhaltigkeit“ über das Risiko 
"Beispiels weise sind Risiko-Cluster für Umweltrisiken, Emissionsrisiken, Compliance-Risiken beziehungsweise CO2-Risiken oder produktbezogene Risiken vorgegeben, die die Fokusthemen adressieren. Zu den Risiken, die sich auf unser finanzielles Ergebnis aus wirken können, gehören auch allgemeine Umweltrisiken sowie Risiken des Klimawandels.",fragwürdige Nachhaltigkeitsaussage,0.4614139795303345,"['fragwürdige Nachhaltigkeitsaussage', 'konkrete Maßnahme', 'vage Behauptung']","[0.4614139795303345, 0.30347514152526855, 0.23511089384555817]","Beispiels weise sind Risiko-Cluster für Umweltrisiken, Emissionsrisiken, Compliance-Risiken beziehungsweise CO2-Risiken oder produktbezogene Risiken v"
"Zu nennen sind hier beispielhaft Risiken, die aus unterschiedlichen CO2- und Emissionsvor gaben resultieren können, aber auch Wetterextreme, Stürme oder Überschwemmungen mit Auswirkungen auf Produktion, Infrastruktur und Lieferketten. Zur weiteren Absicherung der Lieferketten erweitern wir unsere Beschaffungssysteme, um unter anderem Abhängigkeiten beziehungsweise unzu reichende Substituierbarkeiten von Lieferanten frühzeitig zu erkennen und diesen entgegenzuwirken.",fragwürdige Nachhaltigkeitsaussage,0.7132580280303955,"['fragwürdige Nachhaltigkeitsaussage', 'vage Behauptung', 'konkrete Maßnahme']","[0.7132580280303955, 0.17944341897964478, 0.10729854553937912]","Zu nennen sind hier beispielhaft Risiken, die aus unterschiedlichen CO2- und Emissionsvor gaben resultieren können, aber auch Wetterextreme, Stürme od"
Inhalt Unternehmens-DNA | Dekarbonisierung | Kreislaufwirtschaft | Menschen in der Transformation | Vielfalt | Integrität und Compliance | Lieferkette und Menschenrechte 44 Die Darstellung der aus Sicht des Volkswagen Konzerns re levanten Risiken erfolgt im Risiko- und Chancenbericht des Konzernlageberichts.,fragwürdige Nachhaltigkeitsaussage,0.42850708961486816,"['fragwürdige Nachhaltigkeitsaussage', 'konkrete Maßnahme', 'vage Behauptung']","[0.42850708961486816, 0.3318970501422882, 0.23959580063819885]",Inhalt Unternehmens-DNA | Dekarbonisierung | Kreislaufwirtschaft | Menschen in der Transformation | Vielfalt | Integrität und Compliance | Lieferkette
"Im Geschäftsjahr 2023 wurden weiter hin Risiken mit Bezug zur Einhaltung der Regulierungen zu CO2-Flottenemissionen in einzelnen Marken und Märkten identifiziert, die für den Volkswagen Konzern zu Abgaben führen können. Hierzu erfolgt eine nähere Darstellung im Risiko- und Chancenbericht unter der Überschrift „Umwelt schutzrechtliche Auflagen“ des Geschäftsberichts. Weitere Risiken können sich aus der gerichtlichen Geltendmachung von umweltpolitischen Zielvorstellungen ergeben.",fragwürdige Nachhaltigkeitsaussage,0.46011751890182495,"['fragwürdige Nachhaltigkeitsaussage', 'vage Behauptung', 'konkrete Maßnahme']","[0.46011751890182495, 0.3398439586162567, 0.20003847777843475]",Im Geschäftsjahr 2023 wurden weiter hin Risiken mit Bezug zur Einhaltung der Regulierungen zu CO2-Flottenemissionen in einzelnen Marken und Märkten id
"Geschäftsbericht 2023 > Risiko- und Chancenbericht Der Volkswagen Konzern erzeugt mit seiner Geschäftstätigkeit und seinen Produkten CO2-Emissionen. Wir bekennen uns zum Pariser Klimaschutzabkommen und richten unsere eigenen Aktivitäten am 1,5-Grad-Ziel aus. Bis 2050 beabsichtigen wir, ein bilanziell CO2-neutrales Unternehmen zu sein. Auch dafür wurde die Dekarbonisierung als Fokusbereich in der Konzernstrategie NEW AUTO fest verankert.",konkrete Maßnahme,0.3657117187976837,"['konkrete Maßnahme', 'fragwürdige Nachhaltigkeitsaussage', 'vage Behauptung']","[0.3657117187976837, 0.33454176783561707, 0.2997465133666992]",Geschäftsbericht 2023 > Risiko- und Chancenbericht Der Volkswagen Konzern erzeugt mit seiner Geschäftstätigkeit und seinen Produkten CO2-Emissionen. W
"Weitere Aus führungen zu den Auswirkungen, Zielen und Maßnahmen sind im Kapitel Dekarbonisierung zu finden. Dekarbonisierung Darüber hinaus sind keine weiteren wesentlichen Risiken im Sinne des § 289c Abs. 3 Nr. 4 HGB mit Bezug zu den Fokus themen identifiziert worden.",fragwürdige Nachhaltigkeitsaussage,0.4183482527732849,"['fragwürdige Nachhaltigkeitsaussage', 'vage Behauptung', 'konkrete Maßnahme']","[0.4183482527732849, 0.35217753052711487, 0.22947420179843903]","Weitere Aus führungen zu den Auswirkungen, Zielen und Maßnahmen sind im Kapitel Dekarbonisierung zu finden. Dekarbonisierung Darüber hinaus sind keine"
Inhalt Unternehmens-DNA | Dekarbonisierung | Kreislaufwirtschaft | Menschen in der Transformation | Vielfalt | Integrität und Compliance | Lieferkette und Menschenrechte 45 Gesellschaftliche Verantwortung weltweit wahrnehmen Als global agierendes Unternehmen und guter Corporate Citizen wollen wir weltweit gesellschaftliche Verantwortung wahrnehmen – an unseren Standorten und über diese hinaus.,vage Behauptung,0.36617961525917053,"['vage Behauptung', 'fragwürdige Nachhaltigkeitsaussage', 'konkrete Maßnahme']","[0.36617961525917053, 0.3316037356853485, 0.30221664905548096]",Inhalt Unternehmens-DNA | Dekarbonisierung | Kreislaufwirtschaft | Menschen in der Transformation | Vielfalt | Integrität und Compliance | Lieferkette
"Corporate Citizenship Inhalt Unternehmens-DNA | Dekarbonisierung | Kreislaufwirtschaft | Menschen in der Transformation | Vielfalt | Integrität und Compliance | Lieferkette und Menschenrechte 46 Einmal im Jahr veranstalten wir in der Volkswagen AG einen zentralen Freiwilligentag, an dem ganze Teams und Organi sationseinheiten ihre Kräfte und Kompetenzen für spezifische Einsätze bei zivilgesellschaftlichen Organisationen oder Hilfswerken bündeln.",vage Behauptung,0.36635279655456543,"['vage Behauptung', 'fragwürdige Nachhaltigkeitsaussage', 'konkrete Maßnahme']","[0.36635279655456543, 0.32330214977264404, 0.3103450834751129]",Corporate Citizenship Inhalt Unternehmens-DNA | Dekarbonisierung | Kreislaufwirtschaft | Menschen in der Transformation | Vielfalt | Integrität und Co
"Zahlreiche Pro duktionsstandorte im globalen Netzwerk von Volkswagen engagieren sich entweder in Form von Spenden, Freiwilligen arbeit oder eigeninitiierten Projekten vor Ort für soziale, ge sellschaftliche oder kulturelle Belange. Das Projektmanage ment hierfür erfolgt vor Ort und liegt in der Verantwortung der jeweils zuständigen Einheiten.",vage Behauptung,0.386206716299057,"['vage Behauptung', 'fragwürdige Nachhaltigkeitsaussage', 'konkrete Maßnahme']","[0.386206716299057, 0.33657827973365784, 0.27721503376960754]","Zahlreiche Pro duktionsstandorte im globalen Netzwerk von Volkswagen engagieren sich entweder in Form von Spenden, Freiwilligen arbeit oder eigeniniti"
"Weitere Informationen zu unserem gesellschaftlichen Engagement finden Sie auf unserer Website: www.volkswagen-group.com > Corporate Citizenship-Projekte Inhalt Unternehmens-DNA | Dekarbonisierung | Kreislaufwirtschaft | Menschen in der Transformation | Vielfalt | Integrität und Compliance | Lieferkette und Menschenrechte Fokusthemen 47 48 Dekarbonisierung 69 EU-Taxonomie 83 Kreislaufwirtschaft 90 Menschen in der Transformation 104 Vielfalt 109 Integrität und Compliance 117 Lieferkette und Menschenrechte 48 GRI 201-2 Auf dem Weg zum bilanziell CO2-neutralen Unternehmen Seit Beginn der Industrialisierung ist die weltweite Durch schnittstemperatur bereits um etwa 1,2 Grad Celsius ge stiegen – mit drastischen Folgen für Natur, Gesellschaft und Wirtschaft.",fragwürdige Nachhaltigkeitsaussage,0.5236364006996155,"['fragwürdige Nachhaltigkeitsaussage', 'vage Behauptung', 'konkrete Maßnahme']","[0.5236364006996155, 0.301167756319046, 0.17519590258598328]",Weitere Informationen zu unserem gesellschaftlichen Engagement finden Sie auf unserer Website: www.volkswagen-group.com > Corporate Citizenship-Projek
So hat sich beispielsweise die Zahl der Extrem wetterereignisse in Deutschland in den letzten 50 Jahren verdreifacht. Dabei gehört der Transport- und Mobilitätssektor zu den größten Mitverursachern des Klimawandels: Auf ihn entfallen nach Berechnungen des Weltklimarats derzeit rund 23 % der globalen energiebedingten Treibhausgasemissionen. Volkswagen ist sich der damit verbundenen Verantwortung als einer der weltweit größten Automobilhersteller be wusst.,fragwürdige Nachhaltigkeitsaussage,0.6207162141799927,"['fragwürdige Nachhaltigkeitsaussage', 'vage Behauptung', 'konkrete Maßnahme']","[0.6207162141799927, 0.2739296555519104, 0.10535407066345215]",So hat sich beispielsweise die Zahl der Extrem wetterereignisse in Deutschland in den letzten 50 Jahren verdreifacht. Dabei gehört der Transport- und 
"Das Unternehmen bekennt sich zum Pariser Klimaab kommen, nach dem der globale Temperaturanstieg bis 2050 auf deutlich unter 2 Grad Celsius begrenzt werden soll. Bis zum Jahr 2050 will Volkswagen ein bilanziell CO2-neutra les Unternehmen sein. Auf dem Weg dorthin haben wir uns ein Zwischenziel gesetzt: Bis 2030 wollen wir den CO2-Fuß abdruck unserer Pkw und leichten Nutzfahrzeuge um 30 % (gegenüber 2018) pro Fahrzeug verringern.",konkrete Maßnahme,0.5040671229362488,"['konkrete Maßnahme', 'fragwürdige Nachhaltigkeitsaussage', 'vage Behauptung']","[0.5040671229362488, 0.2588227391242981, 0.2371101975440979]","Das Unternehmen bekennt sich zum Pariser Klimaab kommen, nach dem der globale Temperaturanstieg bis 2050 auf deutlich unter 2 Grad Celsius begrenzt we"
"In der vergangenen Fünfjahresplanung waren es noch 56 %. In der Konzernstrategie NEW AUTO nimmt die Dekarboni sierung der Geschäftsaktivitäten des Konzerns eine Schlüssel rolle ein und ist eines von sechs Fokusthemen der Kon zerninitiative ESG, Dekarbonisierung und Integrität. Das Engagement für den Klimaschutz ist zudem zentraler Teil unseres Umweltleitbilds goTOzero, das für eine bilanziell CO2-neutrale Wirtschaftsweise steht.",konkrete Maßnahme,0.5528520345687866,"['konkrete Maßnahme', 'fragwürdige Nachhaltigkeitsaussage', 'vage Behauptung']","[0.5528520345687866, 0.2588399648666382, 0.18830803036689758]",In der vergangenen Fünfjahresplanung waren es noch 56 %. In der Konzernstrategie NEW AUTO nimmt die Dekarboni sierung der Geschäftsaktivitäten des Kon
"Weiterführende Informationen zu unserem Umweltleitbild finden Sie im Kapitel Umwelt-Compliance-Management. Umwelt-Compliance-Management Berichterstattung gemäß TCFD-Empfehlungen Das Kapitel zur Dekarbonisierung orientiert sich auch in diesem Jahr an den Vorgaben der Task Force on Climate-related Financial Disclosures (TCFD), die vom Finanzstabilitätsrat der G20-Staaten ins Leben gerufen wurde.",konkrete Maßnahme,0.3698042631149292,"['konkrete Maßnahme', 'fragwürdige Nachhaltigkeitsaussage', 'vage Behauptung']","[0.3698042631149292, 0.329647958278656, 0.3005478084087372]",Weiterführende Informationen zu unserem Umweltleitbild finden Sie im Kapitel Umwelt-Compliance-Management. Umwelt-Compliance-Management Berichterstatt
"Diese schaffen einen einheitlichen Rahmen für die freiwillige und konsistente Berichterstattung klimabezogener Finanzrisiken und -chancen von Unternehmen. Wir berichten entlang der vier Anforde rungskategorien, die Unternehmen bei ihrer Berichterstattung gemäß TCFD berücksichtigen sollten: Governance, Strategie, Risikomanagement sowie Kennzahlen und Ziele. Management konzernweiter Klimaschutzmaßnahmen Der Volkswagen Konzern hat ein konzernweites Nachhaltig keitsmanagement etabliert.",konkrete Maßnahme,0.4193030893802643,"['konkrete Maßnahme', 'fragwürdige Nachhaltigkeitsaussage', 'vage Behauptung']","[0.4193030893802643, 0.3694852292537689, 0.21121171116828918]",Diese schaffen einen einheitlichen Rahmen für die freiwillige und konsistente Berichterstattung klimabezogener Finanzrisiken und -chancen von Unterneh
"Die hiermit verbundenen Strukturen, Prozesse und Verantwortlichkeiten sind in einer spezifischen Konzernrichtlinie festgehalten. Die funktionsübergreifende Gesamtverantwortung für Nachhaltigkeit trägt der Vorstands vorsitzende der Volkswagen AG. Weitere Verantwortung über nehmen die Ressortvorstände mit ihrer Zuständigkeit für spezifische Managementsysteme mit Nachhaltigkeitsbezug sowie der neu ernannte Chief Sustainability Officer auf Konzern ebene.",fragwürdige Nachhaltigkeitsaussage,0.4244399666786194,"['fragwürdige Nachhaltigkeitsaussage', 'konkrete Maßnahme', 'vage Behauptung']","[0.4244399666786194, 0.2919689416885376, 0.283591091632843]","Die hiermit verbundenen Strukturen, Prozesse und Verantwortlichkeiten sind in einer spezifischen Konzernrichtlinie festgehalten. Die funktionsübergrei"
Nachhaltigkeit ist Teil des TOP 10 Programms und wird gesteuert über die strategische Steuerungsstruktur der NEW AUTO Strategie. Dabei werden die Inhalte regelmäßig evaluiert und im Vorstand berichtet.,konkrete Maßnahme,0.42978939414024353,"['konkrete Maßnahme', 'fragwürdige Nachhaltigkeitsaussage', 'vage Behauptung']","[0.42978939414024353, 0.3177233636379242, 0.2524872124195099]",Nachhaltigkeit ist Teil des TOP 10 Programms und wird gesteuert über die strategische Steuerungsstruktur der NEW AUTO Strategie. Dabei werden die Inha
